{
  "format": "pareto-support-instance",
  "metadata": {
    "family": "random_assignment",
    "seed": 32003
  },
  "objective_transform": [
    {
      "multiplier": "1",
      "offset": "0",
      "sense": "min"
    },
    {
      "multiplier": "1",
      "offset": "0",
      "sense": "min"
    },
    {
      "multiplier": "1",
      "offset": "0",
      "sense": "min"
    }
  ],
  "problem": {
    "n": 5,
    "objectives": [
      {
        "constant": "-3",
        "costs": [
          [
            "71",
            "9",
            "16",
            "38",
            "83"
          ],
          [
            "44",
            "68",
            "83",
            "9",
            "9"
          ],
          [
            "15",
            "40",
            "82",
            "77",
            "29"
          ],
          [
            "84",
            "51",
            "68",
            "30",
            "77"
          ],
          [
            "8",
            "0",
            "70",
            "61",
            "39"
          ]
        ]
      },
      {
        "constant": "-5",
        "costs": [
          [
            "89",
            "16",
            "18",
            "66",
            "56"
          ],
          [
            "6",
            "81",
            "70",
            "1",
            "9"
          ],
          [
            "88",
            "71",
            "62",
            "83",
            "40"
          ],
          [
            "75",
            "21",
            "69",
            "86",
            "73"
          ],
          [
            "19",
            "31",
            "7",
            "50",
            "85"
          ]
        ]
      },
      {
        "constant": "1",
        "costs": [
          [
            "13",
            "17",
            "60",
            "11",
            "83"
          ],
          [
            "33",
            "48",
            "66",
            "23",
            "50"
          ],
          [
            "9",
            "9",
            "85",
            "51",
            "21"
          ],
          [
            "50",
            "83",
            "11",
            "1",
            "73"
          ],
          [
            "39",
            "84",
            "89",
            "77",
            "49"
          ]
        ]
      }
    ],
    "type": "assignment"
  },
  "schema_version": "1.0.0"
}
