{
  "format": "pareto-support-instance",
  "metadata": {
    "family": "random_shortest_path",
    "seed": 33001
  },
  "objective_transform": [
    {
      "multiplier": "1",
      "offset": "0",
      "sense": "min"
    },
    {
      "multiplier": "1",
      "offset": "0",
      "sense": "min"
    },
    {
      "multiplier": "1",
      "offset": "0",
      "sense": "min"
    }
  ],
  "problem": {
    "edges": [
      {
        "costs": [
          "6",
          "12",
          "28"
        ],
        "head": "v1",
        "id": "e0001",
        "tail": "v0"
      },
      {
        "costs": [
          "6",
          "21",
          "10"
        ],
        "head": "v2",
        "id": "e0002",
        "tail": "v1"
      },
      {
        "costs": [
          "30",
          "19",
          "25"
        ],
        "head": "v3",
        "id": "e0003",
        "tail": "v2"
      },
      {
        "costs": [
          "6",
          "27",
          "28"
        ],
        "head": "v4",
        "id": "e0004",
        "tail": "v3"
      },
      {
        "costs": [
          "13",
          "30",
          "1"
        ],
        "head": "v5",
        "id": "e0005",
        "tail": "v4"
      },
      {
        "costs": [
          "28",
          "6",
          "27"
        ],
        "head": "v6",
        "id": "e0006",
        "tail": "v5"
      },
      {
        "costs": [
          "23",
          "18",
          "21"
        ],
        "head": "v7",
        "id": "e0007",
        "tail": "v6"
      },
      {
        "costs": [
          "26",
          "10",
          "35"
        ],
        "head": "v2",
        "id": "e0008",
        "tail": "v0"
      },
      {
        "costs": [
          "2",
          "15",
          "18"
        ],
        "head": "v3",
        "id": "e0009",
        "tail": "v1"
      },
      {
        "costs": [
          "26",
          "1",
          "22"
        ],
        "head": "v4",
        "id": "e0010",
        "tail": "v1"
      }
    ],
    "nodes": [
      "v0",
      "v1",
      "v2",
      "v3",
      "v4",
      "v5",
      "v6",
      "v7"
    ],
    "objective_constants": [
      "0",
      "0",
      "0"
    ],
    "source": "v0",
    "target": "v7",
    "type": "shortest_path"
  },
  "schema_version": "1.0.0"
}
