{
  "format": "pareto-support-instance",
  "metadata": {
    "capacity": 40,
    "family": "random_knapsack",
    "seed": 24004,
    "weights": [
      18,
      6,
      8,
      17,
      15,
      7,
      12,
      6,
      2,
      4
    ]
  },
  "objective_transform": [
    {
      "multiplier": "1",
      "offset": "0",
      "sense": "max"
    },
    {
      "multiplier": "1",
      "offset": "0",
      "sense": "max"
    }
  ],
  "problem": {
    "constraints": [
      {
        "coefficients": [
          "18",
          "6",
          "8",
          "17",
          "15",
          "7",
          "12",
          "6",
          "2",
          "4"
        ],
        "rhs": "40",
        "sense": "<="
      }
    ],
    "n": 10,
    "objectives": [
      {
        "coefficients": [
          "56",
          "56",
          "29",
          "64",
          "40",
          "62",
          "60",
          "8",
          "48",
          "54"
        ],
        "constant": "0"
      },
      {
        "coefficients": [
          "69",
          "33",
          "68",
          "54",
          "41",
          "8",
          "15",
          "7",
          "66",
          "67"
        ],
        "constant": "0"
      }
    ],
    "type": "binary_linear"
  },
  "schema_version": "1.0.0"
}
