{
  "format": "pareto-support-instance",
  "metadata": {
    "purpose": "P1 assignment primal-dual certificate"
  },
  "objective_transform": [
    {
      "multiplier": "1",
      "offset": "0",
      "sense": "min"
    },
    {
      "multiplier": "1",
      "offset": "0",
      "sense": "min"
    },
    {
      "multiplier": "1",
      "offset": "0",
      "sense": "min"
    }
  ],
  "problem": {
    "n": 4,
    "objectives": [
      {
        "constant": "0",
        "costs": [
          [
            "1",
            "14",
            "13",
            "15"
          ],
          [
            "12",
            "2",
            "16",
            "14"
          ],
          [
            "15",
            "13",
            "3",
            "12"
          ],
          [
            "14",
            "16",
            "12",
            "4"
          ]
        ]
      },
      {
        "constant": "0",
        "costs": [
          [
            "4",
            "13",
            "15",
            "14"
          ],
          [
            "16",
            "3",
            "12",
            "15"
          ],
          [
            "13",
            "14",
            "2",
            "16"
          ],
          [
            "15",
            "12",
            "14",
            "1"
          ]
        ]
      },
      {
        "constant": "0",
        "costs": [
          [
            "2",
            "12",
            "16",
            "13"
          ],
          [
            "14",
            "2",
            "13",
            "16"
          ],
          [
            "12",
            "15",
            "2",
            "14"
          ],
          [
            "16",
            "13",
            "15",
            "2"
          ]
        ]
      }
    ],
    "type": "assignment"
  },
  "schema_version": "1.0.0"
}
