{
  "format": "pareto-support-instance",
  "metadata": {
    "family": "tight_explicit",
    "p": 3
  },
  "objective_transform": [
    {
      "multiplier": "1",
      "offset": "0",
      "sense": "min"
    },
    {
      "multiplier": "1",
      "offset": "0",
      "sense": "min"
    },
    {
      "multiplier": "1",
      "offset": "0",
      "sense": "min"
    }
  ],
  "problem": {
    "alternatives": [
      {
        "id": "candidate",
        "raw_objectives": [
          "6",
          "6",
          "6"
        ]
      },
      {
        "id": "challenger_1",
        "raw_objectives": [
          "3",
          "7",
          "7"
        ]
      },
      {
        "id": "challenger_2",
        "raw_objectives": [
          "7",
          "3",
          "7"
        ]
      },
      {
        "id": "challenger_3",
        "raw_objectives": [
          "7",
          "7",
          "3"
        ]
      }
    ],
    "type": "explicit_image"
  },
  "schema_version": "1.0.0"
}
