{
  "format": "pareto-support-instance",
  "metadata": {
    "purpose": "boundary support with a zero weight; candidate is dominated"
  },
  "objective_transform": [
    {
      "multiplier": "1",
      "offset": "0",
      "sense": "min"
    },
    {
      "multiplier": "1",
      "offset": "0",
      "sense": "min"
    }
  ],
  "problem": {
    "alternatives": [
      {
        "id": "x0",
        "raw_objectives": [
          "0",
          "0"
        ]
      },
      {
        "id": "x1",
        "raw_objectives": [
          "0",
          "-1"
        ]
      }
    ],
    "type": "explicit_image"
  },
  "schema_version": "1.0.0"
}
